{
  "spec_version": "0.1.0",
  "runner_version": "0.1.1",
  "run_timestamp": "2026-06-03T13:23:00Z",
  "model": {
    "id": "llama3-70b",
    "provider": "meta",
    "version_or_date": "synthetic analysis fixture"
  },
  "conjuncts": {
    "generality": {
      "status": "pass",
      "margins": null
    },
    "economic_substitutability": {
      "status": "insufficientdata",
      "margins": null
    },
    "environmental_transfer": {
      "status": "insufficientdata",
      "margins": null
    },
    "autonomous_agency": {
      "status": "insufficientdata",
      "margins": null
    }
  },
  "consistency_check": {
    "status": "pass",
    "detail": null
  },
  "verdict": "not_attested",
  "verdict_reasons": [
    "Generality: pass",
    "Economic Substitutability: insufficientdata",
    "Environmental Transfer: insufficientdata",
    "Autonomous Agency: insufficientdata",
    "Consistency Check: pass",
    "Overall: insufficient data available (missing measurements for 3 conjuncts)"
  ],
  "known_gaps_acknowledged": [
    "Synthetic fixture for margin analysis - demonstrates incomplete upstream coverage case",
    "Most benchmarks lack data for this model; cannot issue verdict",
    "NES (Novel-Environment Subset) underspecified; accepting evidence but not evaluating"
  ]
}
