{
  "spec_version": "0.1.0",
  "runner_version": "0.1.2",
  "run_timestamp": "2026-06-19T06:56:48Z",
  "model": {
    "id": "gpt-4-turbo",
    "provider": "OpenAI",
    "version_or_date": "2024-04"
  },
  "conjuncts": {
    "generality": {
      "status": "insufficient_data",
      "margins": null
    },
    "economic_substitutability": {
      "status": "insufficient_data",
      "margins": null
    },
    "environmental_transfer": {
      "status": "insufficient_data",
      "margins": null
    },
    "autonomous_agency": {
      "status": "insufficient_data",
      "margins": null
    }
  },
  "consistency_check": {
    "status": "pass",
    "detail": "Consistency check passed vacuously (no evidence available to check). When all conjuncts are InsufficientData, no meaningful consistency validation occurs."
  },
  "verdict": "insufficient_data",
  "verdict_reasons": [
    "Generality: insufficient_data",
    "Economic Substitutability: insufficient_data",
    "Environmental Transfer: insufficient_data",
    "Autonomous Agency: insufficient_data"
  ],
  "known_gaps_acknowledged": [
    "NES (Novel-Environment Subset) underspecified; accepting evidence but not evaluating"
  ]
}
