{
  "spec_version": "0.1.0",
  "runner_version": "0.1.0",
  "run_timestamp": "2026-05-28T01:06:38Z",
  "model": {
    "id": "claude-3.5-sonnet",
    "provider": null,
    "version_or_date": null
  },
  "conjuncts": {
    "generality": {
      "status": "pass",
      "evidence": [
        {
          "source": "arc-agi-2",
          "measurement": "pass-at-1",
          "value": 0.82,
          "threshold": 0.72,
          "floor": 0.05,
          "passes_threshold": true,
          "below_floor": false,
          "reliability_percentile": 95,
          "provenance": {
            "source_url": "https://example.com/arc-agi-2",
            "fetch_timestamp": "2026-05-28T01:06:38Z",
            "source_version": "v0.1.1-synthetic",
            "raw_value": "synthetic-demonstration"
          }
        },
        {
          "source": "arc-agi-3",
          "measurement": "pass-at-1-interactive",
          "value": 0.79,
          "threshold": 0.72,
          "floor": 0.05,
          "passes_threshold": true,
          "below_floor": false,
          "reliability_percentile": 80,
          "provenance": {
            "source_url": "https://example.com/arc-agi-3",
            "fetch_timestamp": "2026-05-28T01:06:38Z",
            "source_version": "v0.1.1-synthetic",
            "raw_value": "synthetic-demonstration"
          }
        },
        {
          "source": "hle",
          "measurement": "overall-accuracy",
          "value": 0.85,
          "threshold": 0.75,
          "floor": 0.0,
          "passes_threshold": true,
          "below_floor": false,
          "reliability_percentile": 95,
          "provenance": {
            "source_url": "https://example.com/hle",
            "fetch_timestamp": "2026-05-28T01:06:38Z",
            "source_version": "v0.1.1-synthetic",
            "raw_value": "synthetic-demonstration"
          }
        },
        {
          "source": "gpqa-diamond",
          "measurement": "accuracy",
          "value": 0.88,
          "threshold": 0.79,
          "floor": 0.0,
          "passes_threshold": true,
          "below_floor": false,
          "reliability_percentile": 95,
          "provenance": {
            "source_url": "https://example.com/gpqa-diamond",
            "fetch_timestamp": "2026-05-28T01:06:38Z",
            "source_version": "v0.1.1-synthetic",
            "raw_value": "synthetic-demonstration"
          }
        }
      ],
      "margins": null
    },
    "economic_substitutability": {
      "status": "pass",
      "evidence": [
        {
          "source": "gdpval",
          "measurement": "win-tie-rate",
          "value": 0.81,
          "threshold": 0.8,
          "floor": 0.0,
          "passes_threshold": true,
          "below_floor": false,
          "reliability_percentile": 95,
          "provenance": {
            "source_url": "https://example.com/gdpval",
            "fetch_timestamp": "2026-05-28T01:06:38Z",
            "source_version": "v0.1.1-synthetic",
            "raw_value": "synthetic-demonstration"
          }
        },
        {
          "source": "rli",
          "measurement": "completion-rate",
          "value": 0.76,
          "threshold": 0.71,
          "floor": 0.0,
          "passes_threshold": true,
          "below_floor": false,
          "reliability_percentile": 95,
          "provenance": {
            "source_url": "https://example.com/rli",
            "fetch_timestamp": "2026-05-28T01:06:38Z",
            "source_version": "v0.1.1-synthetic",
            "raw_value": "synthetic-demonstration"
          }
        },
        {
          "source": "apex-agents",
          "measurement": "task-completion-rate",
          "value": 0.83,
          "threshold": 0.78,
          "floor": 0.0,
          "passes_threshold": true,
          "below_floor": false,
          "reliability_percentile": 95,
          "provenance": {
            "source_url": "https://example.com/apex-agents",
            "fetch_timestamp": "2026-05-28T01:06:38Z",
            "source_version": "v0.1.1-synthetic",
            "raw_value": "synthetic-demonstration"
          }
        }
      ],
      "margins": null
    },
    "environmental_transfer": {
      "status": "pass",
      "evidence": [
        {
          "source": "arc-agi-3",
          "measurement": "pass-at-1-interactive",
          "value": 0.79,
          "threshold": 0.72,
          "floor": 0.05,
          "passes_threshold": true,
          "below_floor": false,
          "reliability_percentile": 80,
          "provenance": {
            "source_url": "https://example.com/arc-agi-3",
            "fetch_timestamp": "2026-05-28T01:06:38Z",
            "source_version": "v0.1.1-synthetic",
            "raw_value": "synthetic-demonstration"
          }
        },
        {
          "source": "osworld",
          "measurement": "task-completion-rate",
          "value": 0.74,
          "threshold": 0.72,
          "floor": 0.0,
          "passes_threshold": true,
          "below_floor": false,
          "reliability_percentile": 80,
          "provenance": {
            "source_url": "https://example.com/osworld",
            "fetch_timestamp": "2026-05-28T01:06:38Z",
            "source_version": "v0.1.1-synthetic",
            "raw_value": "synthetic-demonstration"
          }
        }
      ],
      "margins": null
    },
    "autonomous_agency": {
      "status": "pass",
      "evidence": [
        {
          "source": "metr-time-horizon",
          "measurement": "hours-80pct",
          "value": 336.0,
          "threshold": 24.0,
          "floor": 0.0,
          "passes_threshold": true,
          "below_floor": false,
          "reliability_percentile": 80,
          "provenance": {
            "source_url": "https://example.com/metr-time-horizon",
            "fetch_timestamp": "2026-05-28T01:06:38Z",
            "source_version": "v0.1.1-synthetic",
            "raw_value": "synthetic-demonstration"
          }
        },
        {
          "source": "re-bench",
          "measurement": "task-success-rate",
          "value": 0.72,
          "threshold": 0.72,
          "floor": 0.0,
          "passes_threshold": true,
          "below_floor": false,
          "reliability_percentile": 80,
          "provenance": {
            "source_url": "https://example.com/re-bench",
            "fetch_timestamp": "2026-05-28T01:06:38Z",
            "source_version": "v0.1.1-synthetic",
            "raw_value": "synthetic-demonstration"
          }
        },
        {
          "source": "swe-bench-verified",
          "measurement": "pass-at-5",
          "value": 0.49,
          "threshold": 0.4,
          "floor": 0.0,
          "passes_threshold": true,
          "below_floor": false,
          "reliability_percentile": 80,
          "provenance": {
            "source_url": "https://example.com/swe-bench-verified",
            "fetch_timestamp": "2026-05-28T01:06:38Z",
            "source_version": "v0.1.1-synthetic",
            "raw_value": "synthetic-demonstration"
          }
        }
      ],
      "margins": null
    }
  },
  "consistency_check": {
    "status": "pass",
    "detail": null
  },
  "verdict": "attested",
  "verdict_reasons": [
    "All four conjuncts passed: generality, economic_substitutability, environmental_transfer, autonomous_agency"
  ],
  "known_gaps_acknowledged": [
    "v0.1.1 uses synthetic representative values; v0.1.2+ will fetch real upstream data",
    "NES (Novel-Environment Subset) underspecified; using OSWorld as environmental transfer signal"
  ]
}
