{
  "spec_version": "0.1.0",
  "runner_version": "0.1.1",
  "run_timestamp": "2026-06-03T13:21:00Z",
  "model": {
    "id": "gpt-4-turbo",
    "provider": "openai",
    "version_or_date": "synthetic analysis fixture"
  },
  "conjuncts": {
    "generality": {
      "status": "pass",
      "margins": null
    },
    "economic_substitutability": {
      "status": "partial",
      "margins": null
    },
    "environmental_transfer": {
      "status": "pass",
      "margins": null
    },
    "autonomous_agency": {
      "status": "pass",
      "margins": null
    }
  },
  "consistency_check": {
    "status": "pass",
    "detail": null
  },
  "verdict": "not_attested",
  "verdict_reasons": [
    "Generality: pass",
    "Economic Substitutability: partial (below threshold)",
    "Environmental Transfer: pass",
    "Autonomous Agency: pass",
    "Consistency Check: pass",
    "Overall: fails conjunctive requirement (economic_substitutability < threshold)"
  ],
  "known_gaps_acknowledged": [
    "Synthetic fixture for margin analysis - demonstrates partial verdict case",
    "NES (Novel-Environment Subset) underspecified; accepting evidence but not evaluating"
  ]
}
